{
  "$schema": "./fihrist.schema.json",
  "format": "fihrist/4",
  "revision": 6,
  "updated": "2026-10-25",
  "groups": [
    { "id": "core", "ar": "الأساسية", "en": "Core", "icon": "layers" },
    { "id": "tools", "ar": "الأدوات", "en": "Tools", "icon": "calc" },
    { "id": "experimental", "ar": "التجريبية", "en": "Experimental", "icon": "flask" },
    { "id": "print", "ar": "الطباعة", "en": "Print", "icon": "printer" }
  ],
  "tools": [
    { "id": "ledger-form", "group": "core", "pigment": "bone", "closed": true,
      "ar": "نموذج الدفتر", "en": "Ledger Form", "dar": "تسجيل خارجي الصيدلية", "den": "Pharmacy ledger entry form",
      "aliases": ["kharegy 2", "khargy", "ledger", "خارجي", "daftar form"], "def": 0,
      "variants": [
        { "id": "main", "ar": "الرئيسي", "en": "Main", "url": "https://slippery-form-2-2.vercel.app/" },
        { "id": "folio", "ar": "فوليو", "en": "Folio", "url": "https://slippery-form.vercel.app/" },
        { "id": "alt", "ar": "بديل", "en": "Alt", "url": "https://datakid-github-io.vercel.app/" }
      ] },
    { "id": "parser", "group": "core", "pigment": "verdigris",
      "ar": "المحلل", "en": "Parser", "dar": "متابعة بيان الخارجي", "den": "Parses raw claim data",
      "aliases": ["kharegy 0", "mohalel", "khargy 0", "خارجي", "parser", "dashboard"], "def": 0,
      "variants": [
        { "id": "main", "ar": "الرئيسي", "en": "Main", "url": "https://lx-parser.vercel.app/" },
        { "id": "alt", "ar": "بديل", "en": "Alt", "url": "https://simpledashboard21.netlify.app/" }
      ] },
    { "id": "workspace", "group": "core", "pigment": "tyrian", "url": "https://desktop-ru4x.vercel.app/",
      "ar": "مجموعات دوائية", "en": "Workspace", "dar": "مساحة عمل المجموعات الدوائية", "den": "Drug-group workspace",
      "aliases": ["majmoat dawaeya", "drug groups", "majmoaat"] },
    { "id": "drug-list", "group": "core", "pigment": "lapis",
      "ar": "قائمة الأدوية", "en": "Drug List", "dar": "قائمة الأدوية القابلة للبحث", "den": "Searchable master drug list",
      "aliases": ["listet el-adwia", "لستة الادوية", "adwia", "list"], "def": 0,
      "variants": [
        { "id": "free", "ar": "مجاني", "en": "Free", "aliases": ["magany", "majani"], "url": "https://searchbar-five-beta.vercel.app/" },
        { "id": "full", "ar": "الكامل", "en": "Full", "aliases": ["kamel", "complete"], "url": "https://lx-search-kappa.vercel.app/" },
        { "id": "alt", "ar": "بديل", "en": "Alt", "url": "https://ag-search.vercel.app/" }
      ] },
    { "id": "paid-calculator", "group": "core", "pigment": "madder",
      "ar": "المنفذ والتحمل", "en": "Paid Calculator", "dar": "حساب المنفذ ونسبة التحمل", "den": "Paid amount and co-pay",
      "aliases": ["monfaz wal tahamol", "monfaz", "tahamol", "copay"], "def": 0,
      "variants": [
        { "id": "main", "ar": "الرئيسي", "en": "Main", "url": "https://newlist-eta.vercel.app/" },
        { "id": "alt", "ar": "دليل قرار 460", "en": "Daleel 460", "dar": "بيان باسعار الخدمات بقرار 460", "den": "Service price statement under Decision 460", "aliases": ["dalil", "qarar 460", "decision 460", "asaar", "اسعار الخدمات"], "url": "https://460-prices.vercel.app/" }
      ] },
    { "id": "protocols", "group": "core", "pigment": "orpiment", "url": "https://strong-snickerdoodle-02a92f.netlify.app/",
      "ar": "بروتوكولات الصرف", "en": "Protocols", "dar": "مرجع بروتوكولات الصرف", "den": "Dispensing protocol reference",
      "aliases": ["brotokolat el-sarf", "sarf", "dispensing"] },
    { "id": "index-builder", "group": "core", "pigment": "indigo", "url": "https://lx-index.vercel.app/", "since": "2026-08-11",
      "ar": "فهرس الأدوية", "en": "Index Builder", "dar": "بناء فهرس الأدوية", "den": "Builds the drug index",
      "aliases": ["fehres el-adwia", "drug index", "fahras"] },
    { "id": "dafter", "group": "core", "pigment": "lapis", "url": "https://daftar-psi-two.vercel.app/", "since": "2026-08-11",
      "ar": "دفتر الحركة", "en": "Dafter", "dar": "تسجيل المنصرف الشهري للصيدلية", "den": "Monthly movement ledger",
      "aliases": ["daftar el-haraka", "daftar", "movement"] },

    { "id": "id-dates", "group": "tools", "pigment": "lapis", "since": "2026-10-09",
      "ar": "أدوات الأرقام", "en": "Number Tools", "dar": "الرقم القومي والتواريخ وجهات الاتصال", "den": "National ID, dates and contacts",
      "aliases": ["adawat el-arqam", "number tools", "arqam", "raqm", "ارقام"], "def": 0,
      "variants": [
        { "id": "id", "ar": "الرقم القومي", "en": "ID and Dates", "dar": "أدوات الرقم القومي والتواريخ", "den": "National ID and date utilities", "aliases": ["raqm qawmy", "national id", "dates", "tarikh", "id tools", "hawia", "adawat el-hawia", "رقم قومي", "تواريخ", "هوية"], "url": "https://lx-id.vercel.app/" },
        { "id": "contacts", "ar": "أدوات جهات الاتصال", "en": "Contact Tools", "dar": "استيراد جهات الاتصال وتنظيفها وتصديرها", "den": "Import, clean up and export contacts", "aliases": ["contact flow", "contacts", "phone numbers", "arqam el-hatef", "hatef", "vcard", "ارقام الهاتف", "هاتف", "جهات اتصال"], "url": "https://contact-flow-web-orpin.vercel.app/" }
      ] },
    { "id": "roi", "group": "tools", "pigment": "verdigris", "since": "2026-08-11",
      "ar": "عائد الاستثمار", "en": "ROI Calculator", "dar": "حاسبة عائد الاستثمار", "den": "Return-on-investment calculator",
      "aliases": ["roi", "aid al-istithmar", "return on investment"], "def": 0,
      "variants": [
        { "id": "express", "ar": "السريع", "en": "Express", "aliases": ["sare3", "saree3", "quick"], "url": "https://roi-calc-express.vercel.app/" },
        { "id": "full", "ar": "الكامل", "en": "Full", "aliases": ["kamel", "complete"], "url": "https://roi-calculator-eight-omega.vercel.app/" }
      ] },
    { "id": "survival-mirror", "group": "tools", "pigment": "malachite", "url": "https://survival-mirror.vercel.app/", "since": "2026-08-25",
      "ar": "منحنى البقاء", "en": "Survival Mirror", "dar": "تقدير منحنى البقاء الشخصي", "den": "Personal survival-curve estimate",
      "aliases": ["monhna el-baqaa", "life expectancy", "baqaa"] },
    { "id": "qisma-mizan", "group": "tools", "pigment": "orpiment", "since": "2026-08-11",
      "ar": "قسمة العوائد", "en": "Qisma / Mizan", "dar": "قسمة إيرادات هيئة التأمين", "den": "Shareholder split and balance",
      "aliases": ["qisma el-awaed"], "def": 0,
      "variants": [
        { "id": "mizan", "ar": "ميزان", "en": "Mizan", "url": "https://m-izan.vercel.app/" },
        { "id": "qisma", "ar": "قسمة", "en": "Qisma", "aliases": ["shareholders"], "url": "https://shareholders-coral.vercel.app/" }
      ] },
    { "id": "solver", "group": "tools", "pigment": "indigo", "url": "https://solver-clone.vercel.app/", "since": "2026-09-26",
      "ar": "حل المعادلات", "en": "Solver", "dar": "حل المعادلات والمسائل الحسابية", "den": "Equation solver",
      "aliases": ["hal el-moadalat", "solver", "equations", "moadla"] },
    { "id": "pattern-recognition", "group": "tools", "pigment": "verdigris", "since": "2026-10-06",
      "ar": "التعرف على أنماط النصوص", "en": "Text Pattern Recognition", "dar": "كشف الصور والنصوص المولّدة وتحليل الأنماط", "den": "Provenance and pattern analysis, on-device",
      "aliases": ["taaruf anmat", "pattern recognition", "text pattern", "pattern", "انماط", "أنماط"], "def": 0,
      "variants": [
        { "id": "lens", "ar": "فحص الأصالة", "en": "Veritas Lens", "aliases": ["fahs el-asala", "asala", "ai detector", "authenticity", "c2pa", "forensics", "كشف", "ذكاء اصطناعي", "تزييف"], "url": "https://pattern-recognition-sooty.vercel.app/" },
        { "id": "alt", "ar": "منظّف", "en": "iCleaner", "aliases": ["cleaner", "monazef"], "url": "https://icleaner-woad.vercel.app/" }
      ] },
    { "id": "plan-maker", "group": "tools", "pigment": "tyrian", "since": "2026-08-30",
      "ar": "الخطة", "en": "Planner", "dar": "توليد خطة مرور دورية", "den": "Recurring visit schedule",
      "aliases": ["el-khetta", "khetta", "plan", "kheta"], "def": 0,
      "variants": [
        { "id": "express", "ar": "السريع", "en": "Express", "aliases": ["sare3", "saree3", "quick", "rushed"], "url": "https://rushed-plan.vercel.app/" },
        { "id": "full", "ar": "الكامل", "en": "Full", "aliases": ["kamel", "complete"], "url": "https://plan-maker-tan.vercel.app/" },
        { "id": "alt", "ar": "بديل", "en": "Alt", "url": "https://alt-plan-maker.vercel.app/" }
      ] },
    { "id": "criteria-builder", "group": "tools", "pigment": "madder", "since": "2026-09-26",
      "ar": "بناء المعايير", "en": "Criteria Builder", "dar": "بناء معايير التقييم والترتيب", "den": "Scoring and ranking criteria",
      "aliases": ["maayir", "criteria", "معايير"], "def": 0,
      "variants": [
        { "id": "meridian", "ar": "ميريديان", "en": "Meridian", "aliases": ["facilities"], "url": "https://facilities-demo-tau.vercel.app/" },
        { "id": "rubric", "ar": "سلّم التقييم", "en": "Rubric", "aliases": ["ranking", "ranking builder", "sollam"], "url": "https://ranking-builder-demo.vercel.app/" }
      ] },
    { "id": "tacit", "group": "tools", "pigment": "bone", "url": "https://tacit-web-lake.vercel.app/", "since": "2026-10-09",
      "ar": "المشغّل", "en": "Tacit", "dar": "مشغّل الروابط بلوحة المفاتيح", "den": "Keyboard-first web launcher",
      "aliases": ["tacit", "launcher", "app launcher", "mushaghel", "mashghal", "تاسيت", "مشغل", "مشغّل"] },
    { "id": "typing-practice", "group": "tools", "pigment": "orpiment", "url": "https://typing-practice-wine-eta.vercel.app/", "since": "2026-10-17",
      "ar": "تمرين الكتابة", "en": "Typing Practice", "dar": "تدريب على الكتابة بلوحة المفاتيح", "den": "Keyboard typing practice",
      "aliases": ["tamreen el-kitaba", "tadreeb", "tadreeb kitaba", "typing", "typing practice", "typing test", "tarq", "keyboard", "kitaba", "تدريب", "تدريب كتابة", "كتابة", "تمرين", "طرق"] },